{
  "candidates": [
    {
      "atom_topology_gate": {
        "atomic_move_note": "curated skill marketplace selection is already landed through the external intake surface",
        "atomic_move_status": "inherited",
        "capability_class": "discover",
        "execution_profile": "small-agent",
        "family_posture": "curated input surfaces; landed external companion",
        "likely_domain": "docs",
        "portability_note": "portable as editorial discovery, not as registry governance or sync machinery",
        "primary_kind": "discovery",
        "risk_posture": "registry-governance-drift",
        "substrate": "docs"
      },
      "candidate": "skill-marketplace-curation",
      "current_gate": "Keep the external intake surface as the canonical donor trail and AOA-T-0041 as the landed contract.",
      "gate_status": "inherited_external",
      "inherited_external_status": "landed as AOA-T-0041",
      "landed_technique": {
        "domain": "docs",
        "id": "AOA-T-0041",
        "path": "techniques/docs/skill-marketplace-curation/TECHNIQUE.md"
      },
      "law_local_bridge": {
        "bridge_stop_line": "do not remap marketplace curation into cross-layer registry governance",
        "higher_law": "the landed technique bundle owns the reusable practice; the external ledger owns donor trail accounting",
        "local_route": "already staged elsewhere in cross-layer candidate ledger"
      },
      "ledger_status": "already_staged_elsewhere",
      "nearest_overlap": [
        "progressive-skill-discovery",
        "AOA-T-0024"
      ],
      "next_move": "use AOA-T-0041 for the landed contract and keep this row as inherited accounting",
      "source_layer": "n-skills",
      "tentative_domain": "docs"
    },
    {
      "atom_topology_gate": {
        "atomic_move_note": "history-to-instructions needs a review gate before it can become a portable technique",
        "atomic_move_status": "inherited",
        "capability_class": "transform",
        "execution_profile": "orchestration-required",
        "family_posture": "history-artifacts or instruction-surface possible; not stable",
        "likely_domain": "not-in-current-domain-map",
        "portability_note": "portable only if instruction changes remain review-gated and explicit",
        "primary_kind": "unassigned-until-narrowed",
        "risk_posture": "hidden-instruction-authority",
        "substrate": "history"
      },
      "candidate": "review-gated-history-derived-instructions",
      "current_gate": "Keep inherited layer incubation until the invariant review gate is stable.",
      "gate_status": "inherited_external",
      "inherited_external_status": "needs layer incubation before distillation here",
      "law_local_bridge": {
        "bridge_stop_line": "do not let history become hidden instruction authority",
        "higher_law": "instruction authority remains with source-owned instruction surfaces",
        "local_route": "already staged elsewhere in cross-layer candidate ledger"
      },
      "ledger_status": "already_staged_elsewhere",
      "nearest_overlap": [],
      "next_move": "incubate only if a strict review gate becomes part of the invariant",
      "source_layer": "SpecStory",
      "tentative_domain": "not in the current domain map"
    },
    {
      "atom_topology_gate": {
        "atomic_move_note": "phase boundary plus handoff packet with continuation permission and stop/return/escalation rule",
        "atomic_move_status": "inherited",
        "capability_class": "handoff",
        "execution_profile": "orchestration-required",
        "family_posture": "handoff-continuation candidate; still active in external ledger",
        "likely_domain": "agent-workflows",
        "portability_note": "portable only as a standalone handoff contract, not as donor orchestration",
        "primary_kind": "handoff",
        "risk_posture": "coordination-drift",
        "substrate": "conversation"
      },
      "candidate": "phase-synchronized-agent-handoff",
      "current_gate": "Keep it staged in the external donor surface until a cleaner phase-checkpoint contract emerges.",
      "gate_status": "inherited_external",
      "inherited_external_status": "future import here",
      "law_local_bridge": {
        "bridge_stop_line": "do not import model routing, shared context server behavior, token optimization, dynamic specialist generation, registry behavior, or dashboard monitoring",
        "higher_law": "donor public material only proves donor orchestration behavior until a narrower public contract appears",
        "local_route": "already staged elsewhere in cross-layer candidate ledger"
      },
      "ledger_status": "already_staged_elsewhere",
      "nearest_overlap": [
        "AOA-T-0001",
        "AOA-T-0023",
        "bounded-specialist-generation"
      ],
      "next_move": "reopen in the external donor surface if a cleaner phase-checkpoint contract emerges",
      "source_layer": "agentwise",
      "tentative_domain": "agent-workflows"
    },
    {
      "atom_topology_gate": {
        "atomic_move_note": "agent registry semantics are still tied to stateful runtime implementation",
        "atomic_move_status": "inherited",
        "capability_class": "write",
        "execution_profile": "orchestration-required",
        "family_posture": "runtime-truth lifecycle possible after spec extraction; not stable",
        "likely_domain": "docs",
        "portability_note": "portable only as a versioned public contract, not as runtime registry dependency",
        "primary_kind": "unassigned-until-narrowed",
        "risk_posture": "runtime-state-drift",
        "substrate": "runtime state"
      },
      "candidate": "versioned-agent-registry-contract",
      "current_gate": "Keep inherited layer incubation until registry semantics separate from implementation.",
      "gate_status": "inherited_external",
      "inherited_external_status": "needs layer incubation before distillation here",
      "law_local_bridge": {
        "bridge_stop_line": "do not import runtime registry implementation as technique canon",
        "higher_law": "runtime registry behavior belongs to the runtime or registry owner until a public contract is extracted",
        "local_route": "already staged elsewhere in cross-layer candidate ledger"
      },
      "ledger_status": "already_staged_elsewhere",
      "nearest_overlap": [],
      "next_move": "incubate until registry semantics can be separated cleanly from registry implementation",
      "source_layer": "agentic",
      "tentative_domain": "docs only after spec extraction"
    },
    {
      "atom_topology_gate": {
        "atomic_move_note": "specialist generation remains mostly role and orchestration behavior",
        "atomic_move_status": "inherited",
        "capability_class": "coordinate",
        "execution_profile": "orchestration-required",
        "family_posture": "agent-workflow possible after narrowing; not stable",
        "likely_domain": "agent-workflows",
        "portability_note": "portable only as one bounded specialist-scope or handoff contract",
        "primary_kind": "unassigned-until-narrowed",
        "risk_posture": "role-orchestration-drift",
        "substrate": "role contracts"
      },
      "candidate": "bounded-specialist-generation",
      "current_gate": "Keep inherited layer incubation until one stable specialist-scope and handoff contract exists.",
      "gate_status": "inherited_external",
      "inherited_external_status": "needs layer incubation before distillation here",
      "law_local_bridge": {
        "bridge_stop_line": "do not import dynamic specialist generation as role or orchestration authority",
        "higher_law": "role and orchestration behavior belongs to role/playbook/routing owners until narrowed",
        "local_route": "already staged elsewhere in cross-layer candidate ledger"
      },
      "ledger_status": "already_staged_elsewhere",
      "nearest_overlap": [
        "phase-synchronized-agent-handoff"
      ],
      "next_move": "wait for one stable specialist-scope and handoff contract before extraction",
      "source_layer": "agentwise",
      "tentative_domain": "agent-workflows only after heavy narrowing"
    },
    {
      "atom_topology_gate": {
        "atomic_move_note": "execution history distillation is still an adaptive learning loop, not one reviewable technique",
        "atomic_move_status": "inherited",
        "capability_class": "learn-from-artifact",
        "execution_profile": "orchestration-required",
        "family_posture": "history-artifacts possible after strict review gate; not stable",
        "likely_domain": "not-in-current-domain-map",
        "portability_note": "portable only as review-gated behavior subordinate to human review",
        "primary_kind": "unassigned-until-narrowed",
        "risk_posture": "adaptive-authority-drift",
        "substrate": "history"
      },
      "candidate": "review-gated-execution-history-distillation",
      "current_gate": "Keep inherited layer incubation until adaptive behavior is subordinate to an explicit distillation contract.",
      "gate_status": "inherited_external",
      "inherited_external_status": "needs layer incubation before distillation here",
      "law_local_bridge": {
        "bridge_stop_line": "do not convert execution history into unsupervised learning authority",
        "higher_law": "review authority and adaptive behavior belong outside technique canon until bounded",
        "local_route": "already staged elsewhere in cross-layer candidate ledger"
      },
      "ledger_status": "already_staged_elsewhere",
      "nearest_overlap": [],
      "next_move": "wait for one explicit distillation contract that keeps adaptive behavior subordinate to human review",
      "source_layer": "agentic",
      "tentative_domain": "not in the current domain map"
    },
    {
      "atom_topology_gate": {